{
  "schema_version": "1.0",
  "generated_at": "2026-08-23T12:15:00Z",
  "service_role": "ai_server_log_forwarder",
  "service_name": "ai_server_log_forwarder",
  "management_type": "systemd",
  "observed_state": "unavailable",
  "enabled_state": "unavailable",
  "health_summary": "unavailable",
  "source_interface": "unavailable",
  "evidence_timestamp": "2026-08-23T12:15:00Z",
  "collection_status": "unavailable",
  "reason_unavailable": "Approved metadata interface is not available in this fixture."
}
